FID,ReachID,Name,Location,County,Basin,WaterType,Uses,Size,SizeUnit,Notes,Assessment,Category,Cause,Source,DataSource,Priority,ObjectID,Shape__Area,Shape__Length
99,GAR030601090318,Savannah Harbor,SR 25 (old US Hwy 17) to Elba Island Cut,Chatham,Savannah,Sound/Harbor,Coastal Fishing,5,Square Miles,"TMDLs completed Bacteria (2000)(Revised 2023), DO (2006) - removed.  5R plan in place to restore water for DO.  The source of impairment for DO is UR, M, I1 and the source for the fish tissue impairments is NP.",Not Supporting,"5, 5R","DO, Fish Tissue (PCBs), Fish Tissue (Thallium)","UR, M, I1, NP","1,10,45",2034,93,17804893.265625,123703.132738006
100,GAR030701031118,High Falls Lake,Entire Lake except area around dam pool,"Butts, Lamar, Monroe",Ocmulgee,Lake,"Recreation, Fishing",532,Acres,TMDL completed Fish Tissue (PCBs) 1998.  The Recreation Use is being met while the Fishing Use is impaired.,Not Supporting,5,Fish Tissue (Thallium),NP,"1,58",2030,48,3078879.29296875,30201.1306515562
101,GAR030701031119,High Falls Lake,Dam Pool,Monroe,Ocmulgee,Lake,"Recreation, Fishing",31,Acres,"TMDL completed Fish Tissue (PCBs) 1998.  The water is supporting its Recreation use, but not its Fishing Use.",Not Supporting,5,Fish Tissue (Thallium),NP,"1,58",2030,49,177251.08984375,2723.91545714788
102,GAR030601020407,Yonah Lake,"Near Tallulah Falls, Georgia","Habersham, Stephens",Savannah,Lake,"Drinking Water, Recreation, Fishing",146.5,Acres,TMDL completed Fish Tissue (Hg) 2005.  The water is supporting its Fishing use.  There is not data available to assess the Recreation and Drinking Water uses.,Assessment Pending,2, , ,1, ,97,879952.12890625,15845.8592730428
103,GAR030701030720,Lake Varner (aka Cornish Creek Reservoir),Near Covington,"Walton, Newton",Ocmulgee,Lake,"Fishing, Drinking Water",814,Acres,The Drinking Water use is in Category 3 due to a lack of data for assessing this use.,Not Supporting,5,Fish Tissue (Cadmium),NP,1,2030,53,4770465.06640625,32241.0959112566
104,GAR031300050225,Lake Bennett,Near Fayetteville,Fayette,Flint,Lake,"Fishing, Drinking Water",56.3,Acres,The water is in Category 3 for Fish Tissue (Mercury) for the Fishing use because the Trophic-weighted residue concentration was between 0.25 and 0.30 mg/kg.  There is no data to assess the Drinking Water use.  TMDL completed Fish Tissue (Hg) 2002.,Assessment Pending,3, , ,1, ,40,328745.23828125,4937.65305366699
105,GAR030602030412,Evans County PFA (Sands Lake),Near Daisy,Evans,Ogeechee,Lake,Fishing,64.7,Acres, ,Supporting,1, , ,1, ,74,365978.23046875,3771.85155005769
106,GAR030701030905,Jackson Lake,"Tussahaw Creek, South River, Yellow River, and Alcovy River Arms","Newton, Butts, Jasper",Ocmulgee,Lake,"Recreation, Fishing",4102,Acres,"TMDLs completed Fish Tissue (PCBs) (1998), Fish Tissue (Mercury) (2002), Fish Tissue (Toxaphene like chlorinated camphenes) (1998).",Not Supporting,"4a, 5","Chlorophyll a, Fish Tissue (PCBs)","NP, UR",1,2030,51,15591416.2148438,186877.933554007